{
  "ticker": "SOFI",
  "date": "2026-02-13",
  "grade": "A-",
  "summary": "SoFi - Digital bank platform transformation (beyond student loans), just turned profitable",
  "entry": "$12.63",
  "current": "$19.61",
  "gain_percent": 55,
  "position_size": "~3-4% of portfolio",
  "action": "Hold, add on dips, don't trim until $30+",
  "full_content": "## SOFI Detailed Analysis ‚Äî DIGITAL BANK PLATFORM (Updated Feb 13, 2026)\n\n### Current Status\n- **Entry:** $12.63 (2,000 shares = $25,260)\n- **Current:** $19.61 (+55.2% gain, +$13,960 unrealized)\n- **Position Size:** ~3-4% of portfolio (Rai wants to increase to 6-8%)\n- **Thesis:** Digital bank platform transformation (beyond student loans)\n- **Conviction:** HIGH ‚Äî just turned profitable, platform forming\n\n### The Three Business Segments\n**1. Lending (40% of revenue)**\n- Personal loans, student loans, home loans\n- Highest margins but rate-sensitive\n- Growing originations despite high rates\n\n**2. Technology Platform ‚Äî Galileo (25%)**\n- Banking-as-a-service for other fintechs\n- **White-label infrastructure = SaaS revenue**\n- Competitive moat, hard to replicate\n\n**3. Financial Services (35%)**\n- SoFi Money (checking/savings)\n- SoFi Invest (brokerage)\n- Credit cards, crypto trading, insurance\n- **Cross-sell engine:** 40% of members use 3+ products\n\n### Why This Fits Rai's Multi-Bagger Strategy\n| Factor | SOFI | Why It Works |\n|--------|------|--------------|\n| **Platform Transformation** | Lending ‚Üí Digital Bank | Like TSLA (cars ‚Üí energy/AI) |\n| **Just Turned Profitable** | 2024: First profit ($0.39 EPS) | Inflection point |\n| **Rapid Growth** | EPS +120% YoY, +366% TTM | Operating leverage |\n| **Member Growth** | 8M+ members, 1M+/quarter | Network effects |\n| **Recurring Revenue** | Galileo SaaS + banking fees | High quality |\n| **Competitive Moat** | Bank charter, tech platform | Hard to replicate |\n\n### Quarterly Progression (Proof of Turnaround)\n| Quarter | EPS | Trend |\n|---------|-----|-------|\n| Q3 2023 | -$0.29 | ‚ùå Losing |\n| Q4 2023 | $0.04 | ‚ö†Ô∏è Breakeven |\n| Q4 2024 | $0.31 | üöÄ Breakout |\n| Q3 2025 | $0.11 (+120%) | üî• Accelerating |\n\n**Real turnaround:** From -$0.29 to +$0.11 in 2 years. EPS growth accelerating.\n\n### 2-5 Year Price Targets\n| Scenario | Probability | Target | Return |\n|----------|-------------|--------|--------|\n| **Bear** (growth stalls) | 25% | $12-15 | -23% to -39% |\n| **Realistic** (platform wins) | 55% | $30-40 | +53% to +104% |\n| **Bull** (becomes THE digital bank) | 20% | $50-70 | +155% to +257% |\n\n### BUY ZONE STRATEGY (Adding to Position)\n**Current:** $19.61 ‚Äî Want to add but waiting for dip\n\n| Price Zone | Dip from Current | Action | Shares to Add | Total Position |\n|------------|------------------|--------|---------------|----------------|\n| **$17-18** | -10-15% | Light add | 500 shares | 2,500 (4-5%) |\n| **$15-16** | -20-25% | Medium add | 1,000 shares | 3,000 (5-6%) |\n| **$12-14** | -30-40% | Heavy add | 1,500 shares | 3,500 (6-7%) |\n| **$10-11** | -45-50% | Back up truck | 2,000 shares | 4,000 (7-8%) |\n| **Below $10** | -50%+ | STOP ‚Äî thesis broken | ‚Äî | Cut losses |\n\n**Rai's Goal:** Build to 6-8% position (from current 3-4%)\n\n### TRIM STRATEGY (Taking Profits)\n**Don't trim until:**\n- **$30-35** ‚Äî Realistic target reached, trim 25-30%\n- **$50+** ‚Äî 3x+ gain achieved, trim 40-50%\n- **$70+** ‚Äî Home run territory, trim 60-70%, hold core\n\n### Why SOFI vs HOOD Comparison\n| Factor | SOFI | HOOD | Winner |\n|--------|------|------|--------|\n| **Profitability** | ‚úÖ Profitable | ‚ùå Still losing | SOFI |\n| **Volatility** | Beta 2.18 | Beta 2.44 | SOFI (less risky) |\n| **Regulatory Moat** | Bank charter | No charter | SOFI |\n| **Revenue Quality** | Recurring (SaaS) | Transactional | SOFI |\n| **Upside Potential** | 3-5x | 3-5x | TIE |\n| **Risk Level** | Medium-High | High | SOFI |\n\n**SOFI is lower risk, similar upside = better risk-adjusted bet**\n\n### Position Sizing Goal\n**Current:** 2,000 shares (~3-4% of portfolio)\n**Target:** 3,500-4,000 shares (~6-8% of portfolio)\n**Method:** Add on 15-25% dips from current\n\n### Bottom Line\n**SOFI Grade: A- (Strong Conviction Multi-Bagger)**\n\n**Rai's Strategy Match:**\n- ‚úÖ Platform transformation early\n- ‚úÖ Just turned profitable (inflection)\n- ‚úÖ Growing 50-100% annually\n- ‚úÖ 3-5x potential over 2-5 years\n- ‚úÖ Lower risk than HOOD, similar upside\n\n**Action Plan:**\n1. **HOLD** current 2,000 shares\n2. **ADD** on dips: $17-18 (light), $15-16 (medium), $12-14 (heavy)\n3. **Build to 6-8%** position over time\n4. **DON'T TRIM** until $30+ (realistic target)\n\n**This is another TSLA/NVDA-style platform play with lower risk than HOOD.**"
}
