{
  "ticker": "RKT",
  "date": "2026-02-13",
  "grade": "B+",
  "summary": "Rocket Companies - Mortgage platform with refi boom potential, trim 40-50% before earnings",
  "entry": "$10",
  "current": "$18.68",
  "gain_percent": 87,
  "position_size": "~4% of portfolio",
  "action": "Trim 40-50% before Feb 26 earnings, hold 50-60% for 5-year platform thesis",
  "full_content": "## RKT Detailed Analysis (Updated Feb 13, 2026)\n\n### Current Status\n- **Entry:** ~$10 (timing not specified)\n- **Current:** $18.68 (+87% gain)\n- **Action:** Trim 40-50% before Feb 26 earnings\n- **Hold:** 50-60% for 5-year platform thesis\n\n### 5-Year Price Targets\n| Scenario | Probability | Target | Annual Return |\n|----------|-------------|--------|---------------|\n| Bear | 25% | $12-16 | -4% to -8% |\n| Realistic | 50% | $28-35 | +8% to +13% |\n| Bull | 25% | $50-70 | +22% to +30% |\n\n### Key Factors\n- ✅ Trump Fed pressure (Warsh appointment likely)\n- ✅ Potential refi boom 2026-2028\n- ⚠️ Q-o-Q earnings still choppy (not META-style turnaround)\n- ⚠️ At $18.68, paying 21x forward earnings (fair, not cheap)\n- ❌ No clear moat yet (hoping platform thesis works)\n\n### Trim Strategy\n- **Sell 40-50%** at $18-19 = lock in $3.20-3.75/share profit\n- **Hold remainder** with stop at $14 (below cost basis)\n- **Reassess:** Post-Feb 26 earnings\n\n### Next Catalyst\n- **Feb 26, 2026:** Q4 2025 earnings\n  - Watch: Production volume, servicing income, guidance\n  - If EPS $0.25+ = trend turning, hold\n  - If negative again = reconsider thesis"
}
