{
  "ticker": "HOOD",
  "date": "2026-02-13",
  "grade": "A",
  "summary": "Robinhood - Fintech platform transformation (not crypto broker), multi-bagger potential",
  "entry": "$48.75",
  "current": "$75.97",
  "gain_percent": 56,
  "position_size": "~4-5% of portfolio",
  "action": "HOLD, add on dips, don't trim until $200+",
  "full_content": "## HOOD Detailed Analysis — PLATFORM THESIS (Updated Feb 13, 2026)\n\n### Current Status\n- **Entry:** $48.75 (700 shares)\n- **Current:** $75.97 (+55.8% gain)\n- **Position Size:** ~4-5% of portfolio\n- **Peak Seen:** $120 (+146%) — didn't sell\n- **Strategy:** Multi-bagger hold (2-5 year horizon)\n- **Thesis:** Fintech platform transformation (not just crypto broker)\n\n### Rai's Platform Thesis (High Conviction)\n**The Market Sees:** Crypto broker (pumps with bitcoin)\n**The Reality:** Fintech platform (diversifying away from crypto)\n\n**Evidence Supporting Thesis:**\n- ✅ Record revenue in 2025 despite crypto -38%\n- ✅ Options trading (highest margin) growing independent of crypto\n- ✅ Prediction markets (elections, sports) = new revenue stream\n- ✅ Net interest income rising with rates\n- ✅ Credit card launch, lending, retirement accounts\n- ✅ 24-hour trading, fractional shares, better UX than Schwab/Fidelity\n- ✅ Innovation speed faster than incumbents\n\n### Revenue Mix Shift\n| Year | Crypto % | Platform % | Trend |\n|------|----------|------------|-------|\n| 2021 | 50%+ | 50% | Crypto dominant |\n| 2023 | 35% | 65% | Diversifying |\n| 2025 | ~25% | ~75% | Platform emerging |\n| 2027 (Est) | <20% | >80% | Platform dominant |\n\n### Multi-Bagger Potential (2-5 Year Targets)\n**If platform thesis plays out:**\n\n| Scenario | Price Target | Return from $48.75 | Timeline |\n|----------|--------------|-------------------|----------|\n| **Bear** (crypto winter, platform fails) | $60-70 | +23-44% | 2 years |\n| **Realistic** (platform recognized) | $150-180 | +208-269% | 2-3 years |\n| **Bull** (fintech platform leader) | $250-350 | +413-618% | 3-5 years |\n\n**Comparison to Rai's Past Winners:**\n- TSLA: Early platform/tech disruption play\n- NVDA: Early AI/data center play\n- PLTR: Early government/enterprise AI platform\n- AMD: Early comeback/competitive moat play\n- **HOOD:** Early fintech platform transformation\n\n### Risk Tolerance Assessment\n**Rai's Profile:**\n- ✅ Can stomach volatility (beta 2.44)\n- ✅ Multi-bagger hunter (200-600% targets)\n- ✅ 2-5 year horizon (not trading, investing)\n- ✅ Will add on dips (dollar-cost averaging)\n- ✅ Domain expertise sees what market misses\n\n**This fits HOOD perfectly:**\n- High volatility = high reward potential\n- Platform transformation = 3-5x if successful\n- Early stage = market hasn't recognized value yet\n- Innovation leader = competitive moat forming\n\n### Action Plan (Multi-Bagger Strategy)\n\n**HOLD Current Position:**\n- 700 shares at $48.75 = core position\n- Target: $150-250 (2-5 years)\n- Don't trim on small gains\n\n**ADD on Dips (If Thesis Intact):**\n- **Buy zone:** $60-70 (20% dip from $76)\n- **Aggressive add:** $50-55 (near cost basis)\n- **Maximum add:** $40-45 (capitulation selling)\n- **Stop adding:** Below $35 (thesis broken)\n\n**Trim/Sell Triggers:**\n- ❌ Platform thesis disproven (crypto still 50%+ of revenue in 2026)\n- ❌ Regulatory shutdown of prediction markets\n- ❌ Schwab/Fidelity catch up on innovation\n- ❌ Massive security breach or fraud\n- ✅ Take profits: $200+ (5x+ gain)\n\n### Key Metrics to Watch\n**Platform Health Indicators:**\n- Non-crypto revenue % (want >75% by 2026)\n- Prediction markets growth (quarterly)\n- Options trading volume vs crypto volume\n- Gold/subscription revenue growth\n- Credit card adoption\n\n**Red Flags:**\n- Crypto revenue re-expanding to 40%+\n- User growth stagnating\n- Platform innovation slowing\n- Competitors catching up\n\n### Position Sizing Strategy\n**Current:** ~4-5% (700 shares @ $48.75)\n**Target max:** 8-10% (if conviction grows)\n**Add scenario:** On 20%+ dips, add 200-300 shares\n**Trim scenario:** Never trim until $200+ (5x+)\n\n### Next Catalysts\n1. **Q1 2026 Earnings (Apr 29):** Non-crypto revenue growth\n2. **Prediction markets update:** Election betting volume\n3. **Credit card metrics:** Adoption rates, spend volume\n4. **International expansion:** UK, EU launches\n5. **Platform narrative shift:** Analyst recognition\n\n### Comparison to Past Winners\n| Stock | Entry Price | Peak | Strategy | HOOD Parallel |\n|-------|-------------|------|----------|---------------|\n| **TSLA** | $30s | $400+ | Platform disruption | Fintech platform |\n| **NVDA** | $50s | $900+ | AI/data center early | Platform shift early |\n| **PLTR** | $10s | $80+ | Government AI platform | Retail platform |\n| **AMD** | $10s | $160+ | Comeback/competitive | vs Schwab/Fidelity |\n| **HOOD** | $48.75 | ??? | Platform transformation | Current opportunity |\n\n### Bottom Line\n**Rai's Strategy:** Find the moat early, ride volatility, 200-600% returns\n**HOOD Fits:** Platform transformation = potential 3-5x over 2-5 years\n**Conviction:** HIGH — market sees crypto, you see platform\n**Action:** HOLD, add on dips, don't trim until $200+\n\n**This is a \"swing for the fences\" position that fits your TSLA/NVDA/PLTR playbook.**"
}
