{
  "ticker": "CRM",
  "date": "2026-02-13",
  "grade": "A-",
  "summary": "Salesforce - AI disruption fear overblown, enterprise switching costs = massive moat",
  "entry": "$182",
  "current": "$189.72",
  "gain_percent": 4,
  "position_size": "~4% (sizable chunk)",
  "action": "HOLD — high conviction based on domain expertise",
  "full_content": "## CRM Detailed Analysis (Auto-saved Feb 13, 2026)\n\n### Current Status\n- **Entry:** $182\n- **Current:** $189.72 (+4.2% gain)\n- **Position Size:** ~4% (sizable chunk)\n- **Action:** HOLD — high conviction based on domain expertise\n- **Thesis:** AI disruption fear overblown, enterprise switching costs = millions\n\n### Key Insights (From Rai's Implementation Experience)\n- Salesforce migrations cost $2-10M+ and 12-24 months\n- Enterprise F500 won't ditch millions in investment for AI pilots\n- Switching costs create massive moat Wall Street underestimates\n- AI disruption hits small companies first, not Salesforce's enterprise base\n\n### 2-Year Price Targets\n| Scenario | Probability | Target | Return |\n|----------|-------------|--------|--------|\n| Bear (AI disrupts) | 20% | $140-160 | -16% to -26% |\n| Realistic (sticky moat wins) | 60% | $260-300 | +37% to +58% |\n| Bull (AI transition succeeds) | 20% | $380-450 | +100% to +137% |\n\n### Fundamentals\n- Forward P/E: 15x (cheap for 20%+ EPS growth)\n- EPS growth accelerating: +39% last quarter\n- Analyst target: $320 (69% upside)\n- Down 42% from highs = oversold\n\n### vs Market Narrative\n- **Market:** \"AI will kill CRM\"\n- **Rai:** \"Implementation costs = locked-in customers\"\n- **Edge:** Domain expertise from Oracle→Salesforce migrations\n\n### Risk Management\n- **Stop loss:** $160 (if AI thesis actually plays out)\n- **Trim target:** $280-300 (take profits on moat re-rating)\n- **Hold through:** Q-to-Q volatility, AI noise\n\n### Next Catalyst\n- **Feb 25, 2026:** Earnings (day before RKT)\n- Watch: Agentforce adoption, revenue growth, margin expansion"
}
